Nama Lokasi;Latitude;Longitude;Jenis;Foto;Cerita
Benteng Cepuri;-7.833415216;110.3987583;Benteng;"foto/Cepuri 1.jpeg;foto/Cepuri 2.jpeg;foto/Cepuri 3.jpeg";"Benteng Cepuri adalah reruntuhan benteng pertahanan peninggalan Kerajaan Mataram Islam, dibangun tahun 1585–1594 M untuk memisahkan kawasan dalam istana (jeron beteng) dari permukiman rakyat (jaba beteng) pada masa Panembahan Senapati dan Sultan Agung. Bentuk dindingnya yang melengkung di sisi tenggara membuat warga menjulukinya ""Bokong Semar"", dan menurut cerita rakyat setempat, salah satu bagian temboknya pernah dijebol oleh Pangeran Rangga, putra Panembahan Senapati (Sumber: Balai Pelestarian Cagar Budaya DIY & detikJogja, 2023)."
Between Two Gates;-7.830933043;110.3990787;Pemukiman;"foto/Between Two Gates 1.jpeg;foto/Between Two Gates 2.jpeg;foto/Between Two Gates 3.jpeg;foto/Between Two Gates 4.jpeg;foto/Between Two Gates 5.jpeg;";"Kawasan permukiman tradisional Jawa di Kampung Alun-Alun, Purbayan, yang dahulu merupakan bekas alun-alun Kotagede pada abad ke-16. Nama ""Between Two Gates"" diberikan oleh Tim Peneliti Arsitektur UGM pada 1986 karena sembilan deret rumah joglo di sini diapit dua gerbang di ujung timur dan barat, terhubung oleh Gang Rukunan. Kawasan ini dikenal sebagai simbol kerukunan warga, karena pendapa rumah dapat dipakai bersama untuk kegiatan sosial (Sumber: Dinas Kebudayaan DIY & Kompasiana, 2024)."
Langgar Dhuwur Boharen Kotagede;-7.829298377;110.4014285;Tempat Ibadah;"foto/Langgar Dhuwur 1.jpeg;foto/Langgar Dhuwur 2.jpeg;foto/Langgar Dhuwur 3.jpeg";"Musala panggung kayu jati berusia lebih dari satu abad ini didirikan oleh Haji Muhsin, salah satu pendiri Syarikatul Mubtadi yang menjadi cikal bakal Muhammadiyah di Kotagede, sesuai angka tahun 1330 Hijriah yang terukir di dindingnya. Nama ""Boharen"" berasal dari kebiasaan mengaji Kitab Hadis Bukhori di sini (""Langgar Bukhorian"") yang lambat laun berubah lafal menjadi ""Boharen"". Pendapa rumahnya pernah menjadi tempat pertemuan tokoh pergerakan kemerdekaan seperti Abdul Kahar Mudzakir (Sumber: Tempo.co, 2023 & RRI Yogyakarta, 2021)."
Makam Hastarenggo;-7.831995862;110.3991604;Makam ;"foto/Makam Hastarenggo 1.jpeg;foto/Makam Hastarenggo 2.jpeg;foto/Makam Hastarenggo 3.jpeg";Dahulu merupakan Dalem Ageng, tempat tinggal utama Panembahan Senopati dan ruang inti keraton Mataram Islam, sebelum dialihfungsikan menjadi makam kerabat (Putra Sentana) Kasultanan Yogyakarta pada masa Sri Sultan Hamengkubuwono VIII. Di sisi selatan kompleks ini tersimpan dua batu bersejarah, Watu Gilang dan Watu Gatheng (Sumber: Makam Kotagede Bantulkab, situs resmi Pemkab Bantul).
Makan dan Masjid Besar Kerajaan Mataram;-7.829779616;110.3989543;Makam dan Tempat Ibadah;"foto/Masjid dan Makam Mataram 1.jpeg;foto/Masjid dan Makam Mataram 2.jpeg;foto/Masjid dan Makam Mataram 3.jpeg;foto/Masjid dan Makam Mataram 4.jpeg;foto/Masjid dan Makam Mataram 5.jpeg";Kompleks Pasarean Hastana Kitha Ageng ini merupakan makam tertua Kerajaan Mataram Islam, dibangun oleh Panembahan Senopati sejak 1589 hingga 1606 menurut Babad Momana. Di dalamnya dimakamkan Panembahan Senopati, ayahnya Ki Ageng Pemanahan, Sultan Hadiwijaya (Joko Tingkir) dari Pajang, serta Ki Ageng Mangir. Terdiri atas tiga cungkup — Prabayaksa, Witana, dan Tajug — kompleks ini kini dikelola bersama oleh Kasultanan Yogyakarta dan Kasunanan Surakarta (Sumber: Jogja Cagar, Pemprov DIY & Klasika Kompas, 2024).
Pasar Legi Kotagede;-7.82830098;110.3997756;Pasar;"foto/Pasar Legi 1.jpeg;foto/Pasar Legi 2.jpeg;foto/Pasar Legi 3.jpeg;foto/Pasar Legi 4.jpeg";"Dikenal sebagai pasar tradisional tertua di Yogyakarta, pasar ini didirikan oleh Ki Gede Pemanahan sejak tahun 1549 sebagai Pasar Gede (Sargedhe), bahkan sebelum ia membangun istana Mataram Islam di Alas Mentaok. Nama ""Legi"" diambil dari hari pasaran Jawa saat pasar ini paling ramai. Direnovasi dan diresmikan kembali pada 22 Februari 1986, pasar ini jauh lebih tua dari Pasar Beringharjo (1758) (Sumber: detikJogja, 2023 & Kompas Yogyakarta, 2024)."
Watu Gilang dan Watu Gatheng;-7.832128864;110.3991555;Situs/Benda Cagar Budaya;"foto/Watu Gilang dan Waru Getheng 1.jpeg;foto/Watu Gilang dan Waru Getheng 2.jpeg;foto/Watu Gilang dan Waru Getheng 3.jpeg";Dua batu peninggalan Mataram Islam yang tersimpan berdampingan di selatan Makam Hastorenggo, diapit dua pohon beringin. Watu Gilang, batu persegi bercekungan berukuran sekitar 2x2 meter, dipercaya sebagai bekas singgasana Panembahan Senopati — dengan retakan yang konon berasal dari benturan kepala Ki Ageng Mangir. Watu Gatheng dipercaya sebagai batu mainan Raden Rangga, putra Panembahan Senopati (Sumber: Kotagedekini Blog, 2020 & Kompasiana, 2021).
